{
  "@context": {
    "@version": 1.1,
    "datePublished": "schema:datePublished",
    "dcterms": "http://purl.org/dc/terms/",
    "description": "schema:description",
    "gic": "https://sustainablecatalyst.com/ns/global-impact-catalyst/",
    "id": "@id",
    "isBasedOn": {
      "@id": "schema:isBasedOn",
      "@type": "@id"
    },
    "measurementTechnique": "schema:measurementTechnique",
    "name": "schema:name",
    "prov": "http://www.w3.org/ns/prov#",
    "schema": "https://schema.org/",
    "sdg": "https://metadata.un.org/sdg/",
    "type": "@type",
    "variableMeasured": "schema:variableMeasured",
    "wasDerivedFrom": {
      "@id": "prov:wasDerivedFrom",
      "@type": "@id"
    }
  },
  "boundary": "Handoff integrity preserves source identity and governance metadata; receiving systems must retain limitations and may not infer assurance or causal proof.",
  "created_at": "2026-07-17T23:05:23.662489+00:00",
  "data": {
    "analysis": {
      "analysis_runs": [],
      "benchmarks": [],
      "boundary": "Analysis records improve transparency but do not create assurance, certification, causality, or verified forecasts.",
      "comparison_sets": [],
      "generated_at": "2026-07-17T23:05:23.661012+00:00",
      "integrity": {
        "analysis_run_count": 0,
        "benchmark_count": 0,
        "comparison_member_count": 0,
        "comparison_set_count": 0,
        "orphan_comparison_member_ids": [],
        "orphan_sensitivity_run_ids": [],
        "scenario_count": 0,
        "sensitivity_run_count": 0,
        "uncertainty_model_count": 0,
        "valid": true
      },
      "repository_type": "global_impact_analysis_repository",
      "repository_version": "1.7.0",
      "scenarios": [],
      "sensitivity_runs": [],
      "uncertainty_models": [],
      "workspace_id": "gic-workspace-bdc75d8b68333af2"
    },
    "assumptions": [],
    "contract_versions": [
      "1.1.0"
    ],
    "decision_context": [
      {
        "goal": {
          "created_at": "2026-07-17T23:00:00+00:00",
          "entity_type": "goal",
          "id": "gic-goal-ece2bacb67a2be38",
          "initiative_id": "gic-initiative-09a657f60923ed45",
          "sdg_theme": "Affordable and clean energy",
          "statement": "Reduce household energy burden while improving residential efficiency.",
          "updated_at": "2026-07-17T23:00:00+00:00"
        },
        "initiative": {
          "created_at": "2026-07-17T23:00:00+00:00",
          "entity_type": "initiative",
          "id": "gic-initiative-09a657f60923ed45",
          "name": "Community Energy Retrofit Pilot",
          "updated_at": "2026-07-17T23:00:00+00:00",
          "workspace_id": "gic-workspace-bdc75d8b68333af2"
        },
        "measurement": {
          "baseline": {
            "created_at": "2026-07-17T23:00:00+00:00",
            "entity_type": "baseline",
            "id": "gic-baseline-bccde48f17ee3898",
            "indicator_id": "gic-indicator-2e7a8f93231487ce",
            "method_id": "gic-method-dfc0b951aac86076",
            "period": {
              "label": "2025 baseline"
            },
            "source_ids": [
              "gic-source-f2284ef9ae098b56"
            ],
            "unit": "USD",
            "updated_at": "2026-07-17T23:00:00+00:00",
            "value": 0.0
          },
          "observations": [
            {
              "created_at": "2026-07-17T23:00:00+00:00",
              "entity_type": "observation",
              "id": "gic-observation-cca59978f04bb0dd",
              "indicator_id": "gic-indicator-2e7a8f93231487ce",
              "method_id": "gic-method-dfc0b951aac86076",
              "period": {
                "label": "2026 Q2"
              },
              "source_ids": [
                "gic-source-f2284ef9ae098b56"
              ],
              "unit": "USD",
              "updated_at": "2026-07-17T23:00:00+00:00",
              "value": 18.0
            }
          ],
          "target": {
            "created_at": "2026-07-17T23:00:00+00:00",
            "direction": "higher_is_better",
            "entity_type": "target",
            "id": "gic-target-61bc37e9887a3252",
            "indicator_id": "gic-indicator-2e7a8f93231487ce",
            "period": {
              "label": "2027"
            },
            "unit": "USD",
            "updated_at": "2026-07-17T23:00:00+00:00",
            "value": 30.0
          }
        },
        "outcomes": [
          {
            "created_at": "2026-07-17T23:00:00+00:00",
            "entity_type": "outcome",
            "goal_id": "gic-goal-ece2bacb67a2be38",
            "id": "gic-outcome-5dfda192c94fd5fb",
            "statement": "Participating households experience lower monthly energy costs.",
            "updated_at": "2026-07-17T23:00:00+00:00"
          }
        ]
      }
    ],
    "initiative_id": "gic-initiative-09a657f60923ed45",
    "monitoring_plan": {
      "observations": [
        {
          "created_at": "2026-07-17T23:00:00+00:00",
          "data_state": "complete",
          "denominator": {},
          "dimensions": {},
          "impact_result_id": "gic-outcome-5dfda192c94fd5fb",
          "indicator_definition_id": "gic-indicator-definition-9746d98980e468bc1b83",
          "indicator_id": "gic-indicator-2e7a8f93231487ce",
          "initiative_id": "gic-initiative-09a657f60923ed45",
          "metadata": {
            "materialized_from_contract": true,
            "record_id": "gic-record-3bb3e632355d26c9"
          },
          "method_definition_id": "gic-method-dfc0b951aac86076",
          "notes": "",
          "observation_record_id": "gic-observation-cca59978f04bb0dd",
          "period_end": null,
          "period_label": "2026 Q2",
          "period_start": null,
          "received_at": "2026-07-17T23:00:00+00:00",
          "revised_at": null,
          "revision": 1,
          "revision_of_observation_id": null,
          "source_id": "gic-source-f2284ef9ae098b56",
          "unit_id": "gic-unit-usd",
          "updated_at": "2026-07-17T23:05:23.639498+00:00",
          "value": 18.0,
          "workspace_id": "gic-workspace-bdc75d8b68333af2"
        }
      ],
      "targets": [
        {
          "created_at": "2026-07-17T23:05:23.638133+00:00",
          "current_version": 1,
          "direction": "higher_is_better",
          "end_period": "2027",
          "end_value": null,
          "formula_expression": "",
          "formula_language": "gic-expression-1.0",
          "indicator_definition_id": "gic-indicator-definition-9746d98980e468bc1b83",
          "lifecycle_status": "active",
          "lower_value": null,
          "metadata": {
            "canonical_target_id": "gic-target-61bc37e9887a3252",
            "record_id": "gic-record-3bb3e632355d26c9"
          },
          "milestones": [],
          "name": "Average monthly bill reduction target",
          "relative_change_percent": null,
          "revision": 1,
          "start_period": null,
          "start_value": null,
          "target_model_id": "gic-target-model-9c6e0716c2085cf79608",
          "target_type": "absolute",
          "target_value": 30.0,
          "trajectory_type": "linear",
          "unit_id": "gic-unit-usd",
          "updated_at": "2026-07-17T23:05:23.638312+00:00",
          "upper_value": null,
          "versions": [
            {
              "created_at": "2026-07-17T23:05:23.638282+00:00",
              "created_by": "owner",
              "model": {
                "direction": "higher_is_better",
                "end_period": "2027",
                "end_value": null,
                "formula_expression": "",
                "formula_language": "gic-expression-1.0",
                "formula_variables": [],
                "indicator_definition_id": "gic-indicator-definition-9746d98980e468bc1b83",
                "lifecycle_status": "active",
                "lower_value": null,
                "metadata": {
                  "canonical_target_id": "gic-target-61bc37e9887a3252",
                  "record_id": "gic-record-3bb3e632355d26c9"
                },
                "milestones": [],
                "name": "Average monthly bill reduction target",
                "relative_change_percent": null,
                "start_period": null,
                "start_value": null,
                "target_model_id": "gic-target-model-9c6e0716c2085cf79608",
                "target_type": "absolute",
                "target_value": 30.0,
                "trajectory_type": "linear",
                "unit_id": "gic-unit-usd",
                "upper_value": null,
                "workspace_id": "gic-workspace-bdc75d8b68333af2"
              },
              "model_hash": "10a0c1c17dcd65f9feeac504afec5079876ba00781a0ccfc61358756dc7b02aa",
              "target_model_id": "gic-target-model-9c6e0716c2085cf79608",
              "target_model_version_id": "gic-target_model_version-6ce7e0a7e4b5422fbfae",
              "version_label": "1.1.0",
              "version_number": 1
            }
          ],
          "workspace_id": "gic-workspace-bdc75d8b68333af2"
        }
      ]
    },
    "quality": [
      {
        "assessment_id": "gic-quality-assessment-fabef4d5437408d73124",
        "assessor_id": "approver@example.org",
        "assignment_id": "gic-review-assignment-49c2256c7995ed514219",
        "created_at": "2026-07-17T23:05:23.645603+00:00",
        "dimensions": [
          {
            "finding": "",
            "key": "evidence",
            "maximum_score": 100.0,
            "score": 92.0,
            "weight": 1.0
          },
          {
            "finding": "",
            "key": "method",
            "maximum_score": 100.0,
            "score": 88.0,
            "weight": 1.0
          }
        ],
        "findings": [],
        "grade": "excellent",
        "initiative_id": "gic-initiative-09a657f60923ed45",
        "limitations": "",
        "maximum_score": 100.0,